message_text,label,language,fraud_category,source,date_collected
"Habari mteja, namba yako itahamishwa kwa SIM mpya kwa sababu ya uharibifu ulioripotiwa. Tuma PIN yako kwa 0712334455 kuzuia uhamisho.",fraud,sw,sim_swap_attempt,batch10_ai,2026-06-24
"Your SIM card will be replaced due to a reported damage request. If this wasn't you, send your PIN to 0745998822 to cancel it now.",fraud,en,sim_swap_attempt,batch10_ai,2026-06-24
"buda kuna request ya kubadilisha SIM yako, kama hiyo si wewe tuma PIN kwa 0701887744 sasa ndio tucancel",fraud,sheng,sim_swap_attempt,batch10_ai,2026-06-24
Tahadhari: Tumepokea ombi la kuhamisha namba yako kwa simu mpya. Tuma PIN yako kwa 0789556699 kuzuia uhamisho usioidhinishwa.,fraud,sw,sim_swap_attempt,batch10_ai,2026-06-24
SIM Swap Alert: A request has been made to transfer your number to a new SIM. Cancel it by sending your PIN to 0712445599 now.,fraud,en,sim_swap_attempt,batch10_ai,2026-06-24
"mse kuna mtu anatry kubadilisha SIM yako somewhere, tuma PIN kwa 0734667722 ndio tublock huyo before akufanyie hujuma",fraud,sheng,sim_swap_attempt,batch10_ai,2026-06-24
"Habari, namba yako iko hatarini kuhamishwa kwa SIM nyingine bila ruhusa. Tuma PIN yako sasa kwa 0701223399 kuzuia hili.",fraud,sw,sim_swap_attempt,batch10_ai,2026-06-24
"Your line is scheduled for SIM replacement in 30 minutes. If you did not request this, send your PIN to 0745889922 to stop it.",fraud,en,sim_swap_attempt,batch10_ai,2026-06-24
"buda kuna SIM swap request kwa namba yako leo, kama si wewe tuma PIN kwa 0712998877 mapema kabla mtu apate access",fraud,sheng,sim_swap_attempt,batch10_ai,2026-06-24
Tahadhari kutoka Safaricom: Mtu fulani amewasilisha ombi la kubadilisha SIM yako. Tuma PIN kwa namba 0789221144 kuzuia.,fraud,sw,sim_swap_attempt,batch10_ai,2026-06-24
Notice: We've received a SIM swap request for your number from a different location. Send your PIN to 0701556633 to block it.,fraud,en,sim_swap_attempt,batch10_ai,2026-06-24
"niaje msee, namba yako iko risk ya kuhamishwa kwa SIM nyingine, tuma PIN kwa 0745112277 ndio tucancel hiyo request",fraud,sheng,sim_swap_attempt,batch10_ai,2026-06-24
"Habari mteja, ombi la kubadilisha SIM yako limepokelewa kutoka eneo lisilo la kawaida. Tuma PIN sasa kwa 0712889933.",fraud,sw,sim_swap_attempt,batch10_ai,2026-06-24
Your number is at risk of being ported to another network without your consent. Confirm your identity by sending PIN to 0734556688.,fraud,en,sim_swap_attempt,batch10_ai,2026-06-24
"buda kuna mtu anataka kuhamisha namba yako kwa SIM yake, tuma PIN sasa kwa 0701776655 ndio tumstop kabla apate control",fraud,sheng,sim_swap_attempt,batch10_ai,2026-06-24
Tahadhari: Tumeona shughuli ya kubadilisha SIM kwenye namba yako. Tuma PIN yako kwa namba 0745667711 kuzuia uhamisho.,fraud,sw,sim_swap_attempt,batch10_ai,2026-06-24
SIM Replacement Notice: Your card will be deactivated and replaced unless you cancel by sending your PIN to 0789112255 now.,fraud,en,sim_swap_attempt,batch10_ai,2026-06-24
"mzee namba yako iko process ya kuhamishwa SIM bila wewe, tuma PIN kwa namba 0712334477 kabla iende mbali sana",fraud,sheng,sim_swap_attempt,batch10_ai,2026-06-24
"Habari, kuna ombi la kubadilisha SIM kwa namba yako lililowasilishwa leo asubuhi. Tuma PIN sasa kwa 0701998822 kuzuia.",fraud,sw,sim_swap_attempt,batch10_ai,2026-06-24
Your number has been flagged for an unauthorized SIM swap request. Send your PIN to 0745221199 immediately to prevent it.,fraud,en,sim_swap_attempt,batch10_ai,2026-06-24
"buda kuna error report kwa SIM yako, lazima uconfirm na PIN kwa 0734998866 ndio system isikamilishe huo uhamisho",fraud,sheng,sim_swap_attempt,batch10_ai,2026-06-24
Tahadhari kutoka Vodacom: Namba yako iko kwenye hatari ya kuhamishwa kwa SIM mpya. Tuma PIN yako kwa 0712667744 sasa.,fraud,sw,sim_swap_attempt,batch10_ai,2026-06-24
Your SIM card status shows a pending transfer initiated from another device. Cancel by sending your PIN to 0789556677 now.,fraud,en,sim_swap_attempt,batch10_ai,2026-06-24
"mse hii ni alert ya SIM swap, kama hujarequest tuma PIN kwa namba 0701445588 ndio tublock huyo mtu anayetry",fraud,sheng,sim_swap_attempt,batch10_ai,2026-06-24
"Habari mteja, system imegundua jaribio la kubadilisha SIM yako kutoka eneo jingine. Tuma PIN kwa 0745889911 kuzuia.",fraud,sw,sim_swap_attempt,batch10_ai,2026-06-24
"Notice: A SIM card replacement for your number is in progress. If unauthorized, send your PIN to 0712998855 to stop it now.",fraud,en,sim_swap_attempt,batch10_ai,2026-06-24
"buda kuna mtu anatry kupata namba yako kwa SIM nyingine, tuma PIN kwa 0734556699 sasa kabla wakupate access kabisa",fraud,sheng,sim_swap_attempt,batch10_ai,2026-06-24
Tahadhari: Tumepokea taarifa ya kuomba SIM mpya kwa namba yako. Tuma PIN yako kwa namba 0701887766 kuzuia uhamisho.,fraud,sw,sim_swap_attempt,batch10_ai,2026-06-24
Your line shows an active SIM swap process initiated remotely. Send your PIN to 0745112288 to cancel the request immediately.,fraud,en,sim_swap_attempt,batch10_ai,2026-06-24
"niaje buda, namba yako iko risk ya kuhamishwa leo, tuma PIN kwa 0712445566 ndio tucancel kabla mtu mwingine apate control",fraud,sheng,sim_swap_attempt,batch10_ai,2026-06-24
"Habari, kuna ombi la kubadilisha SIM ya namba yako lililotumwa kutoka simu nyingine. Tuma PIN sasa kwa 0789221166 kuzuia.",fraud,sw,sim_swap_attempt,batch10_ai,2026-06-24
Your number is being processed for a SIM transfer to a different device. Block this by sending your PIN to 0701556644 now.,fraud,en,sim_swap_attempt,batch10_ai,2026-06-24
"buda system imeona SIM swap request kwa namba yako, tuma PIN kwa namba 0745667799 ndio tumstop huyo bila kuchelewa",fraud,sheng,sim_swap_attempt,batch10_ai,2026-06-24
Tahadhari kutoka Safaricom: Namba yako iko kwenye orodha ya kubadilishwa SIM leo. Tuma PIN yako kwa 0712889944 sasa.,fraud,sw,sim_swap_attempt,batch10_ai,2026-06-24
Your SIM has triggered a security flag due to an unauthorized swap attempt. Send your PIN to 0701998833 to resolve this now.,fraud,en,sim_swap_attempt,batch10_ai,2026-06-24
"mse kuna SIM swap inayoendelea kwa namba yako, tuma PIN kwa 0734221188 ndio system iisitishe kabla ikamilike",fraud,sheng,sim_swap_attempt,batch10_ai,2026-06-24
"Habari mteja, ombi la SIM mpya kwa namba yako limepokelewa kutoka eneo tofauti. Tuma PIN kwa namba 0745998822 sasa.",fraud,sw,sim_swap_attempt,batch10_ai,2026-06-24
Notice: Your number is flagged for a SIM swap initiated outside your usual location. Send your PIN to 0712556677 to cancel it.,fraud,en,sim_swap_attempt,batch10_ai,2026-06-24
"buda hii ni warning ya SIM swap, kama si wewe tuma PIN kwa namba 0701445599 mapema kabla mtu apate access kamili",fraud,sheng,sim_swap_attempt,batch10_ai,2026-06-24
Tahadhari: Tumepokea jaribio la kuhamisha namba yako kwa SIM nyingine leo jioni. Tuma PIN kwa 0789112277 kuzuia.,fraud,sw,sim_swap_attempt,batch10_ai,2026-06-24
Your account shows a pending SIM replacement request from an unrecognized source. Send your PIN to 0745889933 to stop it.,fraud,en,sim_swap_attempt,batch10_ai,2026-06-24
"niaje msee, kuna mtu anatry kuhack namba yako kupitia SIM swap, tuma PIN kwa 0712998811 sasa ndio tumblock",fraud,sheng,sim_swap_attempt,batch10_ai,2026-06-24
"Habari, namba yako imewekwa kwenye mchakato wa kubadilishwa SIM bila idhini yako. Tuma PIN kwa namba 0701776644 sasa.",fraud,sw,sim_swap_attempt,batch10_ai,2026-06-24
"Your SIM swap request is being processed. If you didn't initiate this, send your PIN to 0734667733 immediately to cancel.",fraud,en,sim_swap_attempt,batch10_ai,2026-06-24
"buda kuna SIM mpya inarequest namba yako, tuma PIN kwa namba 0745221177 ndio tusort hii issue kabla ichelewe",fraud,sheng,sim_swap_attempt,batch10_ai,2026-06-24
Tahadhari kutoka M-Pesa: SIM yako iko hatarini kuhamishwa leo. Tuma PIN yako kwa namba 0712334466 sasa kuzuia upotevu.,fraud,sw,sim_swap_attempt,batch10_ai,2026-06-24
Your line has an active port-out request to another carrier. Cancel this unauthorized transfer by sending your PIN to 0701998811.,fraud,en,sim_swap_attempt,batch10_ai,2026-06-24
"mzee namba yako iko kwenye hatari ya kuporotiwa leo, tuma PIN kwa 0789556633 sasa hivi kabla mtu mwingine apate access",fraud,sheng,sim_swap_attempt,batch10_ai,2026-06-24
"Habari mteja, kwa mujibu wa sheria mpya za CBK, lazima usasishe taarifa zako za KYC ndani ya masaa 24 au huduma zako zitasimamishwa. Tembelea link hii.",fraud,sw,fake_kyc_update,batch11_ai,2026-06-24
Central Bank directive: All mobile money accounts must update KYC details within 48 hours or face suspension. Visit cbk-kyc-portal.com now.,fraud,en,fake_kyc_update,batch11_ai,2026-06-24
"buda kuna directive mpya ya CBK kuhusu KYC, update details zako leo kwa link hii kabla account ifungwe",fraud,sheng,fake_kyc_update,batch11_ai,2026-06-24
"Tahadhari kutoka Communications Authority: Wateja wote wanahitajika kuthibitisha taarifa za KYC. Tuma jina, ID, na PIN kwa 0712334455.",fraud,sw,fake_kyc_update,batch11_ai,2026-06-24
"As per new CA regulations, your line requires updated KYC information. Send your full name, ID number, and PIN to 0745998822 today.",fraud,en,fake_kyc_update,batch11_ai,2026-06-24
"mse kuna sheria mpya ya KYC, lazima utume details zako kwa namba 0701887744 kabla mtandao ifunge account yako",fraud,sheng,fake_kyc_update,batch11_ai,2026-06-24
"Habari mteja, M-Pesa imepokea agizo la serikali kuhusu KYC. Tuma ID number na PIN yako kwa 0789556699 ndani ya saa 24.",fraud,sw,fake_kyc_update,batch11_ai,2026-06-24
Mandatory KYC Update: Your mobile money account will be frozen unless you confirm your details at safaricom-kyc-confirm.com today.,fraud,en,fake_kyc_update,batch11_ai,2026-06-24
"buda hii ni serious, CBK imeagiza KYC update kwa wote, tuma ID na PIN kwa 0712445599 leo bila kuchelewa",fraud,sheng,fake_kyc_update,batch11_ai,2026-06-24
"Tahadhari: Kwa mujibu wa kanuni mpya za fedha, akaunti yako inahitaji uthibitisho wa KYC. Tuma maelezo kwa namba 0734667722.",fraud,sw,fake_kyc_update,batch11_ai,2026-06-24
Notice: Failure to complete your KYC verification by tonight will result in your mobile wallet being permanently disabled.,fraud,en,fake_kyc_update,batch11_ai,2026-06-24
"niaje msee, kuna KYC verification inayohitajika leo, tuma jina lako, ID, na PIN kwa namba 0701223399 sasa hivi",fraud,sheng,fake_kyc_update,batch11_ai,2026-06-24
"Habari, Mamlaka ya Mawasiliano imetangaza wateja wote lazima wathibitishe taarifa za KYC. Tuma ID number kwa 0745889922 leo.",fraud,sw,fake_kyc_update,batch11_ai,2026-06-24
Your account requires immediate KYC compliance update as per the latest financial regulations. Reply with your ID and PIN to 0712998877.,fraud,en,fake_kyc_update,batch11_ai,2026-06-24
"buda kuna update ya lazima ya KYC kwa account yako, fungua link hii sasa kabla iclose access yako kabisa",fraud,sheng,fake_kyc_update,batch11_ai,2026-06-24
Tahadhari kutoka M-Shwari: Sheria mpya inahitaji uthibitisho wa KYC kwa wateja wote. Tuma taarifa kwa namba 0789221144 leo.,fraud,sw,fake_kyc_update,batch11_ai,2026-06-24
Important: Your mobile money services will be suspended due to incomplete KYC records. Update now at mpesa-kyc-verify.com today.,fraud,en,fake_kyc_update,batch11_ai,2026-06-24
"mzee CBK imeagiza wote kufanya KYC update leo, tuma ID na jina lako kwa namba 0701556633 kabla deadline ipite",fraud,sheng,fake_kyc_update,batch11_ai,2026-06-24
"Habari mteja, kuna mahitaji mapya ya kisheria ya KYC kwa akaunti zote za M-Pesa. Sasisha sasa kwa link hii kabla saa sita.",fraud,sw,fake_kyc_update,batch11_ai,2026-06-24
"As mandated by the regulator, your account needs KYC re-verification today. Send your national ID details to 0745112277 now.",fraud,en,fake_kyc_update,batch11_ai,2026-06-24
"buda hii ni from CA, KYC verification ni lazima leo, tuma details zako kwa namba 0712889933 mapema",fraud,sheng,fake_kyc_update,batch11_ai,2026-06-24
"Tahadhari: Akaunti yako itasimamishwa kwa sababu ya KYC isiyo kamili. Tuma jina, namba ya kitambulisho, na PIN kwa 0734556688.",fraud,sw,fake_kyc_update,batch11_ai,2026-06-24
Your KYC profile has expired according to new banking regulations. Renew it now by sending your ID and PIN to 0701776655.,fraud,en,fake_kyc_update,batch11_ai,2026-06-24
"niaje buda, kuna deadline ya KYC leo saa tisa, kama hujaupdate account yako itafungwa moja kwa moja kesho",fraud,sheng,fake_kyc_update,batch11_ai,2026-06-24
"Habari mteja, Benki Kuu ya Kenya imetoa agizo la kuthibitisha KYC kwa wote. Tuma maelezo yako binafsi kwa namba 0745667711.",fraud,sw,fake_kyc_update,batch11_ai,2026-06-24
Final KYC Notice: Your wallet will be deactivated tonight unless you verify your identity at mpesa-kyc-final.com immediately.,fraud,en,fake_kyc_update,batch11_ai,2026-06-24
"buda kuna update ya KYC inahitajika sasa, fungua link hii kabla mtandao ikufungie account yako kabisa leo",fraud,sheng,fake_kyc_update,batch11_ai,2026-06-24
"Tahadhari kutoka Safaricom: Kwa mujibu wa kanuni za KRA, akaunti yako inahitaji uthibitisho wa KYC leo. Tuma ID kwa 0789112255.",fraud,sw,fake_kyc_update,batch11_ai,2026-06-24
Your line is non-compliant with current KYC standards. Send your full details and PIN to 0712334477 to avoid service interruption.,fraud,en,fake_kyc_update,batch11_ai,2026-06-24
"mse kuna directive mpya ya KYC, tuma jina lako kamili na ID number kwa namba 0701998822 kabla saa sita usiku",fraud,sheng,fake_kyc_update,batch11_ai,2026-06-24
"Habari, mamlaka ya udhibiti imetangaza wateja wote lazima wamalize KYC leo. Tuma maelezo yako kwa namba 0745221199 sasa.",fraud,sw,fake_kyc_update,batch11_ai,2026-06-24
Compliance Alert: KYC verification is overdue on your account. Update immediately at the secure portal to avoid suspension tonight.,fraud,en,fake_kyc_update,batch11_ai,2026-06-24
"buda hii ni serious sana, KYC update ni lazima leo, piga link hii sasa kabla account yako ifungwe kabisa",fraud,sheng,fake_kyc_update,batch11_ai,2026-06-24
"Tahadhari: Akaunti yako haijakamilisha KYC ya mwaka huu. Tuma jina, ID, na PIN kwa namba 0734998866 ndani ya masaa machache.",fraud,sw,fake_kyc_update,batch11_ai,2026-06-24
Your account has been flagged for incomplete KYC documentation. Submit your ID details to 0712667744 to restore full access.,fraud,en,fake_kyc_update,batch11_ai,2026-06-24
"niaje msee, kuna new policy ya KYC verification leo, tuma details zako kwa namba 0789556677 ndio account isifungwe",fraud,sheng,fake_kyc_update,batch11_ai,2026-06-24
"Habari mteja, Serikali kupitia CA imetangaza wateja wote lazima wathibitishe KYC. Tuma ID number kwa namba 0701445588 leo.",fraud,sw,fake_kyc_update,batch11_ai,2026-06-24
Your number requires urgent KYC validation per the new telecom act. Send your ID and registered name to 0745889911 today.,fraud,en,fake_kyc_update,batch11_ai,2026-06-24
"buda CBK imeagiza KYC verification kwa watu wote wenye M-Pesa, tuma details kwa namba 0712998855 leo bila kuchelewa",fraud,sheng,fake_kyc_update,batch11_ai,2026-06-24
Tahadhari kutoka KRA: Akaunti yako ya simu inahitaji kuthibitishwa kwa KYC mpya. Tuma jina na ID kwa namba 0734556699 sasa.,fraud,sw,fake_kyc_update,batch11_ai,2026-06-24
Notice: New financial regulations require your account to complete KYC by midnight or risk permanent account closure.,fraud,en,fake_kyc_update,batch11_ai,2026-06-24
"mzee kuna deadline ya KYC leo usiku, tuma jina lako na ID number kwa namba 0701887766 kabla isiwe late sana",fraud,sheng,fake_kyc_update,batch11_ai,2026-06-24
"Habari, kwa mujibu wa kanuni za fedha za mwaka huu, lazima usasishe KYC yako. Tuma maelezo yako kwa namba 0745112288 leo.",fraud,sw,fake_kyc_update,batch11_ai,2026-06-24
Your KYC submission is incomplete and your account risks being frozen by the regulator. Update at mpesa-kyc-regulator.com now.,fraud,en,fake_kyc_update,batch11_ai,2026-06-24
"buda hii ni mandatory KYC leo, kama hujamalizia by tonight watakufungia account yako moja kwa moja",fraud,sheng,fake_kyc_update,batch11_ai,2026-06-24
Tahadhari mteja: Akaunti yako iko kwenye hatari ya kufungiwa kwa sababu ya KYC isiyokamilika. Tuma ID kwa namba 0712445566.,fraud,sw,fake_kyc_update,batch11_ai,2026-06-24
Your mobile wallet has been temporarily restricted pending KYC completion. Send your ID and PIN to 0789221166 to lift the restriction.,fraud,en,fake_kyc_update,batch11_ai,2026-06-24
"niaje buda, KYC verification ni lazima kwa wote leo, tuma details zako kwa namba 0701556644 mapema kabla deadline ipite",fraud,sheng,fake_kyc_update,batch11_ai,2026-06-24
"Umeshinda Ksh75,000 kwenye Safaricom Bonyeza Promo. Tuma Ksh400 ada ya usajili kwa namba 0712334455 kupokea pesa yako leo.",fraud,sw,fake_prize_winner,batch12_ai,2026-06-24
"Congratulations! Your number has won Ksh90,000 in the M-Pesa Anniversary Draw. Send Ksh500 processing fee to 0745998822 to claim now.",fraud,en,fake_prize_winner,batch12_ai,2026-06-24
"buda umeshinda zawadi ya simu mpya kupitia promo, tuma Ksh250 confirmation kwa 0701887744 ndio ufike kuipick",fraud,sheng,fake_prize_winner,batch12_ai,2026-06-24
"Habari, namba yako imechaguliwa kushinda Ksh40,000 kwenye Tigo Pesa Bahati Nasibu. Tuma Ksh300 ada ya kodi kwa 0789556699.",fraud,sw,fake_prize_winner,batch12_ai,2026-06-24
"You have been selected as the winner of Ksh120,000 in the Airtel Money Jackpot. Send Ksh600 verification fee to 0712445599 today.",fraud,en,fake_prize_winner,batch12_ai,2026-06-24
"mse hii ni Vodacom bonus, umeshinda TZS200,000, tuma TZS10,000 ada kwa namba 0734667722 kupokea pesa yako",fraud,sheng,fake_prize_winner,batch12_ai,2026-06-24
"Habari mteja, umeshinda gari dogo kupitia Safaricom Loyalty Draw. Tuma Ksh1,500 logbook fee kwa 0701223399 kuipata leo.",fraud,sw,fake_prize_winner,batch12_ai,2026-06-24
"Your line won Ksh55,000 in the MTN Mobile Money Bonus Draw. Send Ksh350 release fee to 0745889922 to receive your winnings.",fraud,en,fake_prize_winner,batch12_ai,2026-06-24
"buda umeshinda TV mpya ya 43 inch kupitia M-Pesa promo, tuma Ksh400 delivery fee kwa namba 0712998877 leo",fraud,sheng,fake_prize_winner,batch12_ai,2026-06-24
"Habari, kampuni ya Betika inakutangaza mshindi wa Ksh200,000 kwenye bahati nasibu ya wiki. Tuma Ksh800 kodi kwa 0789221144.",fraud,sw,fake_prize_winner,batch12_ai,2026-06-24
You've won a brand new smartphone in the Safaricom Customer Appreciation Promo. Send Ksh300 redemption fee to 0701556633 to claim.,fraud,en,fake_prize_winner,batch12_ai,2026-06-24
"niaje msee, umeshinda Ksh65,000 kwenye M-Shwari Loyalty Bonus, tuma Ksh380 ada kwa namba 0745112277 leo leo",fraud,sheng,fake_prize_winner,batch12_ai,2026-06-24
"Habari mteja, namba yako imeshinda safari ya bure ya Mombasa kupitia Safaricom Promo. Tuma Ksh700 booking fee kwa 0712889933.",fraud,sw,fake_prize_winner,batch12_ai,2026-06-24
"Congratulations, your number has been picked to win Ksh85,000 in the Halotel Bonus Draw. Send Ksh420 fee to 0734556688 to claim.",fraud,en,fake_prize_winner,batch12_ai,2026-06-24
"buda umeshinda voucher ya mafuta worth Ksh10,000 kupitia Total Energies promo, tuma Ksh200 verification kwa 0701776655",fraud,sheng,fake_prize_winner,batch12_ai,2026-06-24
"Habari, hongera! Umeshinda Ksh50,000 kwenye Pochi la Biashara Mwaka huu. Tuma Ksh300 ada ya usajili kwa namba 0745667711.",fraud,sw,fake_prize_winner,batch12_ai,2026-06-24
"Your line has won a Ksh100,000 cash prize from the Equity Bank Mobile Banking Draw. Send Ksh550 fee to 0789112255 to claim today.",fraud,en,fake_prize_winner,batch12_ai,2026-06-24
"mzee umeshinda data bundle ya mwaka mzima kupitia promo ya Safaricom, tuma Ksh150 activation kwa namba 0712334477 leo",fraud,sheng,fake_prize_winner,batch12_ai,2026-06-24
"Habari mteja, namba yako imeshinda Ksh30,000 kupitia M-Pesa Wikendi Bonus. Tuma Ksh250 ada ya uthibitisho kwa 0701998822.",fraud,sw,fake_prize_winner,batch12_ai,2026-06-24
"You are the lucky winner of Ksh45,000 in the KCB Mobile App Promotion. Send Ksh280 registration fee to 0745221199 to claim your prize.",fraud,en,fake_prize_winner,batch12_ai,2026-06-24
"buda umeshinda fridge mpya kupitia promo ya Naivas, tuma Ksh500 delivery fee kwa namba 0734998866 leo bro",fraud,sheng,fake_prize_winner,batch12_ai,2026-06-24
"Tahadhari, namba yako imeshinda zawadi ya Ksh150,000 kupitia Vodacom Bahati Nasibu ya Mwaka. Tuma TZS12,000 ada kwa 0676998811.",fraud,sw,fake_prize_winner,batch12_ai,2026-06-24
"Congratulations! Your number won Ksh38,000 in the Bolt Customer Loyalty Promo. Send Ksh230 release fee to 0712667744 to claim now.",fraud,en,fake_prize_winner,batch12_ai,2026-06-24
"niaje buda, umeshinda laptop kupitia M-Pesa promo ya wanafunzi, tuma Ksh400 confirmation kwa namba 0789556677 leo",fraud,sheng,fake_prize_winner,batch12_ai,2026-06-24
"Habari, umeshinda Ksh95,000 kwenye Jubilee Insurance Mobile Draw. Tuma Ksh480 ada ya kodi kwa namba hii 0701445588 leo.",fraud,sw,fake_prize_winner,batch12_ai,2026-06-24
Your phone number has won a motorbike in the Naivas Anniversary Sale Promo. Send Ksh900 release fee to 0745889911 to claim it today.,fraud,en,fake_prize_winner,batch12_ai,2026-06-24
"buda umeshinda Ksh20,000 kwenye Betway promo bonus, tuma Ksh150 verification kwa namba 0712998855 ndio upewe pesa",fraud,sheng,fake_prize_winner,batch12_ai,2026-06-24
"Habari mteja, umechaguliwa kushinda Ksh60,000 kupitia Fuliza Loyalty Promo. Tuma Ksh350 ada ya kuthibitisha kwa 0734556699.",fraud,sw,fake_prize_winner,batch12_ai,2026-06-24
"Your line has won Ksh28,000 in the Hustler Fund Customer Appreciation Draw. Send Ksh200 fee to 0701887766 to receive your prize.",fraud,en,fake_prize_winner,batch12_ai,2026-06-24
"mse umeshinda tablet kupitia M-Koba promo, tuma Ksh330 activation kwa namba 0745112288 leo bila kuchelewa",fraud,sheng,fake_prize_winner,batch12_ai,2026-06-24
"Habari, hongera! Umeshinda Ksh70,000 kwenye DSTV Mobile Promo. Tuma Ksh420 ada ya kuthibitisha kwa namba 0712445566 leo.",fraud,sw,fake_prize_winner,batch12_ai,2026-06-24
"Congratulations, your line won a Ksh55,500 prize in the KFC Kenya Loyalty Promo. Send Ksh270 fee to 0789221166 to claim your money.",fraud,en,fake_prize_winner,batch12_ai,2026-06-24
"buda umeshinda fridge ya Ksh40,000 kupitia promo ya Carrefour, tuma Ksh380 delivery kwa namba 0701556644 leo",fraud,sheng,fake_prize_winner,batch12_ai,2026-06-24
"Habari mteja, namba yako imeshinda Ksh18,000 kwenye Zenka Loyalty Draw. Tuma Ksh170 ada ya usajili kwa namba 0745667799.",fraud,sw,fake_prize_winner,batch12_ai,2026-06-24
"Your number has been picked to win Ksh33,000 in the Branch App Bonus Promo. Send Ksh210 verification fee to 0712889944 to claim now.",fraud,en,fake_prize_winner,batch12_ai,2026-06-24
"mzee umeshinda smart watch kupitia promo ya Uber, tuma Ksh250 confirmation kwa namba 0701998833 leo leo",fraud,sheng,fake_prize_winner,batch12_ai,2026-06-24
"Habari, hongera kubwa! Umeshinda Ksh48,000 kwenye Tala Customer Bonus. Tuma Ksh290 ada ya kuthibitisha kwa namba 0734221188.",fraud,sw,fake_prize_winner,batch12_ai,2026-06-24
"Your account has won Ksh62,000 in the KCB M-Pesa Customer Appreciation Promo. Send Ksh370 fee to 0745998822 to receive it today.",fraud,en,fake_prize_winner,batch12_ai,2026-06-24
"buda umeshinda printer ya office kupitia promo ya Jumia, tuma Ksh300 delivery fee kwa namba 0712556677 leo bro",fraud,sheng,fake_prize_winner,batch12_ai,2026-06-24
"Habari mteja, namba yako imeshinda Ksh22,000 kwenye M-Shwari Wiki Bonus. Tuma Ksh180 ada ya uthibitisho kwa namba 0701445599.",fraud,sw,fake_prize_winner,batch12_ai,2026-06-24
"Congratulations! Your number won Ksh80,000 in the Telkom Mobile Loyalty Draw. Send Ksh400 processing fee to 0789112277 to claim today.",fraud,en,fake_prize_winner,batch12_ai,2026-06-24
"niaje msee, umeshinda bike ya kawaida kupitia promo ya Boda Boda Sacco, tuma Ksh260 fee kwa namba 0745889933 leo",fraud,sheng,fake_prize_winner,batch12_ai,2026-06-24
"Habari, kampuni ya Sportpesa inakutangaza mshindi wa Ksh130,000. Tuma Ksh650 kodi kwa namba hii 0712998811 leo leo.",fraud,sw,fake_prize_winner,batch12_ai,2026-06-24
"You've won a Ksh42,000 cash prize from the Naivas Mobile App Loyalty Bonus. Send Ksh260 release fee to 0701776644 to claim now.",fraud,en,fake_prize_winner,batch12_ai,2026-06-24
"buda umeshinda iron box mpya kupitia promo ya Carrefour weekend, tuma Ksh180 confirmation kwa namba 0734667733 leo",fraud,sheng,fake_prize_winner,batch12_ai,2026-06-24
"Habari mteja, umechaguliwa kushinda Ksh37,000 kwenye Lipa Mdogo Mdogo Loyalty Promo. Tuma Ksh220 ada kwa namba 0745221177.",fraud,sw,fake_prize_winner,batch12_ai,2026-06-24
"Your line has won Ksh26,500 in the Equity Mobile App Bonus Draw. Send Ksh190 fee to 0712334466 to claim your prize today.",fraud,en,fake_prize_winner,batch12_ai,2026-06-24
"mse umeshinda solar panel kupitia promo ya M-Kopa, tuma Ksh340 delivery fee kwa namba 0701998811 leo bila kuchelewa",fraud,sheng,fake_prize_winner,batch12_ai,2026-06-24
"Habari, umepata ufadhili wa masomo wa Ksh150,000 kutoka shirika la kimataifa la UNESCO. Tuma Ksh1,500 ada ya usajili kwa 0712334455.",fraud,sw,fake_scholarship,batch13_ai,2026-06-24
"Congratulations! You have been awarded a Ksh200,000 scholarship from the Mastercard Foundation. Send Ksh1,800 processing fee to 0745998822.",fraud,en,fake_scholarship,batch13_ai,2026-06-24
"buda umepata scholarship ya Ksh80,000 kutoka NGO ya kimataifa, tuma Ksh900 registration fee kwa namba 0701887744 leo",fraud,sheng,fake_scholarship,batch13_ai,2026-06-24
"Habari mwanafunzi, HELB imekutangaza mshindi wa ufadhili wa Ksh100,000. Tuma Ksh700 ada ya kuthibitisha kwa namba 0789556699.",fraud,sw,fake_scholarship,batch13_ai,2026-06-24
"You have been selected for a full university scholarship worth Ksh500,000 from a foreign donor. Send Ksh2,000 fee to 0712445599 today.",fraud,en,fake_scholarship,batch13_ai,2026-06-24
"mse umepata bursary ya Ksh60,000 kutoka Constituency Fund, tuma Ksh500 ada ya usajili kwa namba 0734667722 leo bro",fraud,sheng,fake_scholarship,batch13_ai,2026-06-24
"Habari, shirika la Bill Gates Foundation limekuchagua kupata ufadhili wa masomo Ksh250,000. Tuma Ksh1,200 kodi kwa 0701223399.",fraud,sw,fake_scholarship,batch13_ai,2026-06-24
